{
  "$schema": "./atum.lock.schema.json",
  "schemaVersion": "atum.dev/lock/v1",
  "desiredSha256": "ca42d6dd9fa9684b66ac98bf6c5e62765aabef7018ecad2468c29c6fc3a14e26",
  "resolved": {
    "clusterReleases": [
      {
        "kubernetes": "1.35.4",
        "kubespray": {
          "url": "https://github.com/kubernetes-sigs/kubespray.git",
          "version": "v2.31.0",
          "commit": "1c9add48975060f45396b34d8e022c30d7f80dab"
        },
        "checksums": {
          "kubelet": "sha256:983a6ba5a49823dcdd745c674e5e2416377dd27d6ad1b42d2befa0fb961a19f6",
          "kubeadm": "sha256:0c0497da793f8897c14e45340da919534b615294a1aab69dc1998896c0f11145",
          "kubectl": "sha256:b529430df69a688fd61b64ad2299edb5fd71cb58be2a4779dba624c7d3510efd"
        }
      }
    ],
    "kubespray": [
      {
        "schemaVersion": "atum.dev/kubespray-artifacts/v8",
        "kubernetesVersion": "1.35.4",
        "kubesprayCommit": "1c9add48975060f45396b34d8e022c30d7f80dab",
        "inventoryScope": "selected-runtime",
        "selectionInputSha256": "bc4361af1825877027671d31409f1bee0b9e0592481ea6770c3d3d2283534b4a",
        "selectedInventorySha256": "3560fd9e2451c2d0474366833e7aee5639d87fcafa39671e1abf9e64a6f784af",
        "files": [
          {
            "id": "calico_crds",
            "source": "https://github.com/projectcalico/calico/raw/v3.31.5/manifests/crds.yaml",
            "repositoryPath": "github.com/projectcalico/calico/raw/v3.31.5/manifests/crds.yaml",
            "cacheFile": ".atum/cache/kubespray-offline/sha256/1d6d5e523f92ee1e8227a48c016229c668f94035431b82f19139affeb45dbeff",
            "sha256": "1d6d5e523f92ee1e8227a48c016229c668f94035431b82f19139affeb45dbeff",
            "size": 305670
          },
          {
            "id": "calicoctl",
            "source": "https://github.com/projectcalico/calico/releases/download/v3.31.5/calicoctl-linux-amd64",
            "repositoryPath": "github.com/projectcalico/calico/releases/download/v3.31.5/calicoctl-linux-amd64",
            "cacheFile": ".atum/cache/kubespray-offline/sha256/d1dd3a3fb2f5640987eab589dc1dcb03c47c11b32bc19a65c45c39421cd887d2",
            "sha256": "d1dd3a3fb2f5640987eab589dc1dcb03c47c11b32bc19a65c45c39421cd887d2",
            "size": 82760842
          },
          {
            "id": "cni",
            "source": "https://github.com/containernetworking/plugins/releases/download/v1.9.1/cni-plugins-linux-amd64-v1.9.1.tgz",
            "repositoryPath": "github.com/containernetworking/plugins/releases/download/v1.9.1/cni-plugins-linux-amd64-v1.9.1.tgz",
            "cacheFile": ".atum/cache/kubespray-offline/sha256/b98f74a0f8522f0a83867178729c1aa70f2158f90c45a2ca8fa791db1c76b303",
            "sha256": "b98f74a0f8522f0a83867178729c1aa70f2158f90c45a2ca8fa791db1c76b303",
            "size": 55418181
          },
          {
            "id": "containerd",
            "source": "https://github.com/containerd/containerd/releases/download/v2.2.3/containerd-2.2.3-linux-amd64.tar.gz",
            "repositoryPath": "github.com/containerd/containerd/releases/download/v2.2.3/containerd-2.2.3-linux-amd64.tar.gz",
            "cacheFile": ".atum/cache/kubespray-offline/sha256/ca26ef5138f17b847bbeeec36d4bf5e002b54d25858197a870c125d57f44d32f",
            "sha256": "ca26ef5138f17b847bbeeec36d4bf5e002b54d25858197a870c125d57f44d32f",
            "size": 35352990
          },
          {
            "id": "crictl",
            "source": "https://github.com/kubernetes-sigs/cri-tools/releases/download/v1.35.0/crictl-v1.35.0-linux-amd64.tar.gz",
            "repositoryPath": "github.com/kubernetes-sigs/cri-tools/releases/download/v1.35.0/crictl-v1.35.0-linux-amd64.tar.gz",
            "cacheFile": ".atum/cache/kubespray-offline/sha256/2e141e5b22cb189c40365a11807d69b76b9b3caced89fac2f4ec879408ce2177",
            "sha256": "2e141e5b22cb189c40365a11807d69b76b9b3caced89fac2f4ec879408ce2177",
            "size": 19185064
          },
          {
            "id": "etcd",
            "source": "https://github.com/etcd-io/etcd/releases/download/v3.6.10/etcd-v3.6.10-linux-amd64.tar.gz",
            "repositoryPath": "github.com/etcd-io/etcd/releases/download/v3.6.10/etcd-v3.6.10-linux-amd64.tar.gz",
            "cacheFile": ".atum/cache/kubespray-offline/sha256/ed579fafab5701e3aaa95509969e7bc74776a4ae5269d32e3928408b406456ec",
            "sha256": "ed579fafab5701e3aaa95509969e7bc74776a4ae5269d32e3928408b406456ec",
            "size": 24798802
          },
          {
            "id": "kubeadm",
            "source": "https://dl.k8s.io/release/v1.35.4/bin/linux/amd64/kubeadm",
            "repositoryPath": "dl.k8s.io/release/v1.35.4/bin/linux/amd64/kubeadm",
            "cacheFile": ".atum/cache/kubespray-offline/sha256/0c0497da793f8897c14e45340da919534b615294a1aab69dc1998896c0f11145",
            "sha256": "0c0497da793f8897c14e45340da919534b615294a1aab69dc1998896c0f11145",
            "size": 72413368
          },
          {
            "id": "kubectl",
            "source": "https://dl.k8s.io/release/v1.35.4/bin/linux/amd64/kubectl",
            "repositoryPath": "dl.k8s.io/release/v1.35.4/bin/linux/amd64/kubectl",
            "cacheFile": ".atum/cache/kubespray-offline/sha256/b529430df69a688fd61b64ad2299edb5fd71cb58be2a4779dba624c7d3510efd",
            "sha256": "b529430df69a688fd61b64ad2299edb5fd71cb58be2a4779dba624c7d3510efd",
            "size": 58613944
          },
          {
            "id": "kubelet",
            "source": "https://dl.k8s.io/release/v1.35.4/bin/linux/amd64/kubelet",
            "repositoryPath": "dl.k8s.io/release/v1.35.4/bin/linux/amd64/kubelet",
            "cacheFile": ".atum/cache/kubespray-offline/sha256/983a6ba5a49823dcdd745c674e5e2416377dd27d6ad1b42d2befa0fb961a19f6",
            "sha256": "983a6ba5a49823dcdd745c674e5e2416377dd27d6ad1b42d2befa0fb961a19f6",
            "size": 58138916
          },
          {
            "id": "nerdctl",
            "source": "https://github.com/containerd/nerdctl/releases/download/v2.2.2/nerdctl-2.2.2-linux-amd64.tar.gz",
            "repositoryPath": "github.com/containerd/nerdctl/releases/download/v2.2.2/nerdctl-2.2.2-linux-amd64.tar.gz",
            "cacheFile": ".atum/cache/kubespray-offline/sha256/6f637760fb2875e3454e97c3de7438fd17281b5996908cbd8ee1c872b0653cc8",
            "sha256": "6f637760fb2875e3454e97c3de7438fd17281b5996908cbd8ee1c872b0653cc8",
            "size": 11373900
          },
          {
            "id": "runc",
            "source": "https://github.com/opencontainers/runc/releases/download/v1.4.2/runc.amd64",
            "repositoryPath": "github.com/opencontainers/runc/releases/download/v1.4.2/runc.amd64",
            "cacheFile": ".atum/cache/kubespray-offline/sha256/ac8a90f9e225bb9322189937b230cdc5478d5753f0e31e1bda98a5cf06bd9539",
            "sha256": "ac8a90f9e225bb9322189937b230cdc5478d5753f0e31e1bda98a5cf06bd9539",
            "size": 12233104
          }
        ],
        "images": [
          "kubespray-cluster-proportional-autoscaler-3040b7500ee3",
          "kubespray-cni-1e7d398d64e9",
          "kubespray-coredns-c0a1763e2e8b",
          "kubespray-kube-apiserver-a41c80c0ea0e",
          "kubespray-kube-controller-manager-6380ebf00c81",
          "kubespray-kube-controllers-ab24c787861c",
          "kubespray-kube-proxy-f41a80af8ea3",
          "kubespray-kube-scheduler-ec5cf060af83",
          "kubespray-node-77c1a7981006",
          "kubespray-pause-6bafff9caf95"
        ]
      }
    ],
    "bigBang": {
      "url": "https://repo1.dso.mil/big-bang/bigbang.git",
      "version": "3.31.1",
      "commit": "b9a49842b930b4e5706265d26867ee7f0ba79d5b",
      "kubeVersion": "\u003e=1.34.0-0"
    },
    "flux": {
      "url": "https://github.com/fluxcd/flux2.git",
      "version": "2.9.4",
      "ref": "v2.9.4",
      "commit": "889be9d6cc8afa8ed639e1e1ba4ab678e3b38d8c",
      "assets": [
        {
          "id": "install-manifest",
          "url": "https://github.com/fluxcd/flux2/releases/download/v2.9.4/manifests.tar.gz",
          "file": "platform/clusters/atum/flux-system/gotk-components.yaml",
          "sourceSha256": "3683107415b8d97fc82b7a8825b6b2d0773d87d37101f391f9a7594c82e59c5b",
          "sha256": "c25997b4cfbcbc72f70b2c30dbb1609e2773a0cfc462ffebf54c2f07029ebb4b"
        }
      ]
    },
    "packages": [
      {
        "id": "authservice",
        "valuesPath": "addons.authservice",
        "license": "https://repo1.dso.mil/big-bang/product/packages/authservice.git @ 5fd08540ea1b83d1e697e2f5507b6f04c5cc5c53 / LICENSE",
        "integration": "integrated",
        "chartPath": "chart",
        "source": {
          "url": "https://repo1.dso.mil/big-bang/product/packages/authservice.git",
          "version": "1.1.5-bb.7",
          "branch": "main",
          "commit": "5fd08540ea1b83d1e697e2f5507b6f04c5cc5c53"
        }
      },
      {
        "id": "cloudnative-pg",
        "valuesPath": "packages.cloudnative-pg",
        "license": "https://repo1.dso.mil/big-bang/product/maintained/cloudnative-pg.git @ 8067614001663dba175f5d229c9e6bb5cb23ccf8 / LICENSE",
        "integration": "generic",
        "chartPath": "chart",
        "source": {
          "url": "https://repo1.dso.mil/big-bang/product/maintained/cloudnative-pg.git",
          "version": "0.29.0-bb.0",
          "branch": "main",
          "commit": "8067614001663dba175f5d229c9e6bb5cb23ccf8"
        }
      },
      {
        "id": "fluentbit",
        "valuesPath": "fluentbit",
        "license": "https://repo1.dso.mil/big-bang/product/packages/fluentbit.git @ c85d4ca665b9a59645c68f1246ff653d68e5d82b",
        "integration": "integrated",
        "chartPath": "chart",
        "source": {
          "url": "https://repo1.dso.mil/big-bang/product/packages/fluentbit.git",
          "version": "0.57.9-bb.0",
          "branch": "main",
          "commit": "c85d4ca665b9a59645c68f1246ff653d68e5d82b"
        }
      },
      {
        "id": "garage",